{
  "schemaVersion": "0.4.0",
  "capturedAt": "2026-04-25T10:00:00+00:00",
  "tick": 400,
  "seed": 42,
  "simVersion": "0.4.0-dev",
  "clock": {
    "gameTimeDisplay": "Day 1 10:00",
    "dayNumber": 1,
    "isDaytime": true,
    "circadianFactor": 0.85,
    "timeScale": 1.0,
    "sun": {
      "azimuthDeg": 140.0,
      "elevationDeg": 45.0,
      "dayPhase": "midMorning"
    }
  },
  "entities": [
    {
      "id": "11111111-1111-1111-1111-111111111111",
      "shortId": "H-001",
      "name": "Alice",
      "species": "human",
      "position": {
        "x": 3.0,
        "y": 0.0,
        "z": 3.0,
        "hasPosition": true
      },
      "drives": {
        "dominant": "None",
        "eatUrgency": 0.1,
        "drinkUrgency": 0.15,
        "sleepUrgency": 0.05,
        "defecateUrgency": 0.0,
        "peeUrgency": 0.1
      },
      "physiology": {
        "satiation": 75.0,
        "hydration": 85.0,
        "bodyTemp": 36.6,
        "energy": 90.0,
        "sleepiness": 5.0,
        "isSleeping": false
      },
      "social": {
        "drives": {
          "belonging":  { "current": 72, "baseline": 55 },
          "status":     { "current": 45, "baseline": 45 },
          "affection":  { "current": 30, "baseline": 40 },
          "irritation": { "current": 65, "baseline": 20 },
          "attraction": { "current": 20, "baseline": 20 },
          "trust":      { "current": 50, "baseline": 60 },
          "suspicion":  { "current": 35, "baseline": 15 },
          "loneliness": { "current": 40, "baseline": 30 }
        },
        "willpower": { "current": 45, "baseline": 70 },
        "inhibitions": [
          { "class": "confrontation", "strength": 80, "awareness": "known" },
          { "class": "vulnerability", "strength": 90, "awareness": "hidden" }
        ],
        "personalityTraits": [
          { "dimension": "openness", "value": 1 },
          { "dimension": "extraversion", "value": 2 },
          { "dimension": "neuroticism", "value": -1 }
        ],
        "currentMood": "irritable",
        "vocabularyRegister": "casual"
      }
    },
    {
      "id": "22222222-2222-2222-2222-222222222222",
      "shortId": "H-002",
      "name": "Bob",
      "species": "human",
      "position": {
        "x": 7.0,
        "y": 0.0,
        "z": 7.0,
        "hasPosition": true
      },
      "drives": {
        "dominant": "None",
        "eatUrgency": 0.3,
        "drinkUrgency": 0.2,
        "sleepUrgency": 0.1,
        "defecateUrgency": 0.0,
        "peeUrgency": 0.05
      },
      "physiology": {
        "satiation": 60.0,
        "hydration": 70.0,
        "bodyTemp": 36.8,
        "energy": 70.0,
        "sleepiness": 20.0,
        "isSleeping": false
      }
    }
  ],
  "worldItems": [],
  "worldObjects": [],
  "rooms": [
    {
      "id": "aaaaaaaa-0001-0000-0000-000000000000",
      "name": "first-floor-breakroom",
      "category": "breakroom",
      "floor": "first",
      "boundsRect": { "x": 10, "y": 5, "width": 8, "height": 6 },
      "illumination": {
        "ambientLevel": 55,
        "colorTemperatureK": 4200,
        "dominantSourceId": "bbbbbbbb-0001-0000-0000-000000000000"
      }
    }
  ],
  "lightSources": [
    {
      "id": "bbbbbbbb-0001-0000-0000-000000000000",
      "kind": "breakroomStrip",
      "state": "on",
      "intensity": 70,
      "colorTemperatureK": 4200,
      "position": { "x": 14, "y": 8 },
      "roomId": "aaaaaaaa-0001-0000-0000-000000000000"
    }
  ],
  "invariants": {
    "violationCount": 0
  },
  "relationships": [
    {
      "id": "aaaa0000-0000-0000-0000-000000000000",
      "participantA": "11111111-1111-1111-1111-111111111111",
      "participantB": "22222222-2222-2222-2222-222222222222",
      "patterns": ["rival"],
      "intensity": 85,
      "historyEventIds": [
        "cccc0001-0000-0000-0000-000000000000",
        "cccc0002-0000-0000-0000-000000000000"
      ]
    }
  ],
  "chronicle": [
    {
      "id": "cccc0001-0000-0000-0000-000000000000",
      "kind": "spilledSomething",
      "tick": 120,
      "participants": ["11111111-1111-1111-1111-111111111111"],
      "location": "first-floor-breakroom",
      "description": "Alice knocked over her coffee in a surge of irritation.",
      "persistent": true,
      "physicalManifestEntityId": "dddddddd-0001-0000-0000-000000000000"
    },
    {
      "id": "cccc0002-0000-0000-0000-000000000000",
      "kind": "publicArgument",
      "tick": 300,
      "participants": [
        "11111111-1111-1111-1111-111111111111",
        "22222222-2222-2222-2222-222222222222"
      ],
      "location": "first-floor-breakroom",
      "description": "Alice and Bob had a heated argument about the missing project files.",
      "persistent": true
    },
    {
      "id": "cccc0003-0000-0000-0000-000000000000",
      "kind": "other",
      "tick": 380,
      "participants": ["22222222-2222-2222-2222-222222222222"],
      "description": "Bob made an unusual comment that nobody could interpret.",
      "persistent": false
    }
  ]
}
