{
  "schemaVersion": "0.3.0",
  "capturedAt": "2026-04-25T09:30:00+00:00",
  "tick": 300,
  "seed": 42,
  "simVersion": "0.3.0-dev",
  "clock": {
    "gameTimeDisplay": "Day 1 09:30",
    "dayNumber": 1,
    "isDaytime": true,
    "circadianFactor": 0.9,
    "timeScale": 1.0,
    "sun": {
      "azimuthDeg": 120.0,
      "elevationDeg": 35.0,
      "dayPhase": "midMorning"
    }
  },
  "entities": [
    {
      "id": "11111111-1111-1111-1111-111111111111",
      "shortId": "H-001",
      "name": "Alice",
      "species": "human",
      "position": {
        "x": 3.0,
        "y": 0.0,
        "z": 3.0,
        "hasPosition": true
      },
      "drives": {
        "dominant": "None",
        "eatUrgency": 0.1,
        "drinkUrgency": 0.15,
        "sleepUrgency": 0.05,
        "defecateUrgency": 0.0,
        "peeUrgency": 0.1
      },
      "physiology": {
        "satiation": 75.0,
        "hydration": 85.0,
        "bodyTemp": 36.6,
        "energy": 90.0,
        "sleepiness": 5.0,
        "isSleeping": false
      },
      "social": {
        "drives": {
          "belonging":  { "current": 72, "baseline": 55 },
          "status":     { "current": 45, "baseline": 45 },
          "affection":  { "current": 30, "baseline": 40 },
          "irritation": { "current": 65, "baseline": 20 },
          "attraction": { "current": 20, "baseline": 20 },
          "trust":      { "current": 50, "baseline": 60 },
          "suspicion":  { "current": 35, "baseline": 15 },
          "loneliness": { "current": 40, "baseline": 30 }
        },
        "willpower": { "current": 45, "baseline": 70 },
        "inhibitions": [
          { "class": "confrontation", "strength": 80, "awareness": "known" },
          { "class": "vulnerability", "strength": 90, "awareness": "hidden" }
        ],
        "personalityTraits": [
          { "dimension": "openness", "value": 1 },
          { "dimension": "extraversion", "value": 2 },
          { "dimension": "neuroticism", "value": -1 }
        ],
        "currentMood": "focused",
        "vocabularyRegister": "casual"
      }
    },
    {
      "id": "22222222-2222-2222-2222-222222222222",
      "shortId": "H-002",
      "name": "Bob",
      "species": "human",
      "position": {
        "x": 7.0,
        "y": 0.0,
        "z": 7.0,
        "hasPosition": true
      },
      "drives": {
        "dominant": "None",
        "eatUrgency": 0.3,
        "drinkUrgency": 0.2,
        "sleepUrgency": 0.1,
        "defecateUrgency": 0.0,
        "peeUrgency": 0.05
      },
      "physiology": {
        "satiation": 60.0,
        "hydration": 70.0,
        "bodyTemp": 36.8,
        "energy": 70.0,
        "sleepiness": 20.0,
        "isSleeping": false
      }
    }
  ],
  "worldItems": [],
  "worldObjects": [],
  "rooms": [
    {
      "id": "aaaaaaaa-0001-0000-0000-000000000000",
      "name": "first-floor-breakroom",
      "category": "breakroom",
      "floor": "first",
      "boundsRect": { "x": 10, "y": 5, "width": 8, "height": 6 },
      "illumination": {
        "ambientLevel": 55,
        "colorTemperatureK": 4200,
        "dominantSourceId": "bbbbbbbb-0001-0000-0000-000000000000"
      }
    },
    {
      "id": "aaaaaaaa-0002-0000-0000-000000000000",
      "name": "first-floor-office-12",
      "category": "office",
      "floor": "first",
      "boundsRect": { "x": 2, "y": 5, "width": 4, "height": 4 },
      "illumination": {
        "ambientLevel": 70,
        "colorTemperatureK": 3200,
        "dominantSourceId": "bbbbbbbb-0002-0000-0000-000000000000"
      }
    }
  ],
  "lightSources": [
    {
      "id": "bbbbbbbb-0001-0000-0000-000000000000",
      "kind": "breakroomStrip",
      "state": "flickering",
      "intensity": 65,
      "colorTemperatureK": 4200,
      "position": { "x": 14, "y": 8 },
      "roomId": "aaaaaaaa-0001-0000-0000-000000000000"
    },
    {
      "id": "bbbbbbbb-0002-0000-0000-000000000000",
      "kind": "deskLamp",
      "state": "on",
      "intensity": 75,
      "colorTemperatureK": 2800,
      "position": { "x": 3, "y": 6 },
      "roomId": "aaaaaaaa-0002-0000-0000-000000000000"
    },
    {
      "id": "bbbbbbbb-0003-0000-0000-000000000000",
      "kind": "overheadFluorescent",
      "state": "dying",
      "intensity": 30,
      "colorTemperatureK": 4500,
      "position": { "x": 12, "y": 6 },
      "roomId": "aaaaaaaa-0001-0000-0000-000000000000"
    }
  ],
  "lightApertures": [
    {
      "id": "cccccccc-0001-0000-0000-000000000000",
      "position": { "x": 2, "y": 5 },
      "roomId": "aaaaaaaa-0002-0000-0000-000000000000",
      "facing": "south",
      "areaSqTiles": 3.0
    }
  ],
  "invariants": {
    "violationCount": 0
  },
  "relationships": [
    {
      "id": "aaaa0000-0000-0000-0000-000000000000",
      "participantA": "11111111-1111-1111-1111-111111111111",
      "participantB": "22222222-2222-2222-2222-222222222222",
      "patterns": ["rival", "oldFlame"],
      "intensity": 80,
      "historyEventIds": ["bbbb0000-0000-0000-0000-000000000000"]
    }
  ],
  "memoryEvents": [
    {
      "id": "bbbb0000-0000-0000-0000-000000000000",
      "tick": 150,
      "participants": [
        "11111111-1111-1111-1111-111111111111",
        "22222222-2222-2222-2222-222222222222"
      ],
      "kind": "confrontation",
      "scope": "pair",
      "description": "Alice and Bob argued in the break room about the missing lunch.",
      "persistent": true,
      "relationshipId": "aaaa0000-0000-0000-0000-000000000000"
    }
  ]
}
