{
  "schemaVersion": "0.2.1",
  "capturedAt": "2026-04-25T10:00:00+00:00",
  "tick": 200,
  "seed": 99,
  "simVersion": "0.2.1-dev",
  "clock": {
    "gameTimeDisplay": "Day 1 10:00",
    "dayNumber": 1,
    "isDaytime": true,
    "circadianFactor": 0.8,
    "timeScale": 1.0
  },
  "entities": [
    {
      "id": "11111111-1111-1111-1111-111111111111",
      "shortId": "H-001",
      "name": "Alice",
      "species": "human",
      "position": {
        "x": 3.0,
        "y": 0.0,
        "z": 3.0,
        "hasPosition": true
      },
      "drives": {
        "dominant": "None",
        "eatUrgency": 0.1,
        "drinkUrgency": 0.15,
        "sleepUrgency": 0.05,
        "defecateUrgency": 0.0,
        "peeUrgency": 0.1
      },
      "physiology": {
        "satiation": 75.0,
        "hydration": 85.0,
        "bodyTemp": 36.6,
        "energy": 90.0,
        "sleepiness": 5.0,
        "isSleeping": false
      },
      "social": {
        "drives": {
          "belonging":  { "current": 72, "baseline": 55 },
          "status":     { "current": 45, "baseline": 45 },
          "affection":  { "current": 30, "baseline": 40 },
          "irritation": { "current": 65, "baseline": 20 },
          "attraction": { "current": 20, "baseline": 20 },
          "trust":      { "current": 50, "baseline": 60 },
          "suspicion":  { "current": 35, "baseline": 15 },
          "loneliness": { "current": 40, "baseline": 30 }
        },
        "willpower": { "current": 45, "baseline": 70 },
        "inhibitions": [
          { "class": "confrontation", "strength": 80, "awareness": "known" },
          { "class": "vulnerability", "strength": 90, "awareness": "hidden" }
        ],
        "personalityTraits": [
          { "dimension": "openness", "value": 1 },
          { "dimension": "extraversion", "value": 2 },
          { "dimension": "neuroticism", "value": -1 }
        ],
        "currentMood": "tense",
        "vocabularyRegister": "casual"
      }
    },
    {
      "id": "22222222-2222-2222-2222-222222222222",
      "shortId": "H-002",
      "name": "Bob",
      "species": "human",
      "position": {
        "x": 7.0,
        "y": 0.0,
        "z": 7.0,
        "hasPosition": true
      },
      "drives": {
        "dominant": "None",
        "eatUrgency": 0.3,
        "drinkUrgency": 0.2,
        "sleepUrgency": 0.1,
        "defecateUrgency": 0.0,
        "peeUrgency": 0.05
      },
      "physiology": {
        "satiation": 60.0,
        "hydration": 70.0,
        "bodyTemp": 36.8,
        "energy": 70.0,
        "sleepiness": 20.0,
        "isSleeping": false
      }
    }
  ],
  "worldItems": [],
  "worldObjects": [],
  "invariants": {
    "violationCount": 0
  },
  "relationships": [
    {
      "id": "aaaa0000-0000-0000-0000-000000000000",
      "participantA": "11111111-1111-1111-1111-111111111111",
      "participantB": "22222222-2222-2222-2222-222222222222",
      "patterns": ["rival", "oldFlame"],
      "intensity": 80,
      "historyEventIds": ["bbbb0000-0000-0000-0000-000000000000"]
    }
  ],
  "memoryEvents": [
    {
      "id": "bbbb0000-0000-0000-0000-000000000000",
      "tick": 150,
      "participants": [
        "11111111-1111-1111-1111-111111111111",
        "22222222-2222-2222-2222-222222222222"
      ],
      "kind": "confrontation",
      "scope": "pair",
      "description": "Alice and Bob argued in the break room about the missing lunch.",
      "persistent": true,
      "relationshipId": "aaaa0000-0000-0000-0000-000000000000"
    }
  ]
}
